{
  "schemaVersion": 1,
  "planId": "e14-new-information-hypothesis-plan-v1",
  "frozenAt": "2026-07-15",
  "researchBoundary": "Design-only preregistration after E14.6h. Source acquisition, feature materialization, taxonomy mutation, candidate generation, fitting, evaluation, ranking, composition, outer OOS and promotion are forbidden.",
  "sourceCatalog": [
    {
      "sourceId": "fdic-aggregate-time-series",
      "provider": "Federal Deposit Insurance Corporation",
      "url": "https://www.fdic.gov/bank-data-guide/data-downloads",
      "coverageFrom": "1984-01-01",
      "frequency": "quarterly",
      "availabilityClass": "release-archived",
      "role": "Aggregate loss absorption, asset quality, capital and liability composition for banking-credit.",
      "knownLimitations": ["Quarterly observations require release-date joins and explicit age.", "Field definitions and population changes require a break manifest."]
    },
    {
      "sourceId": "federal-reserve-h8",
      "provider": "Board of Governors of the Federal Reserve System",
      "url": "https://www.federalreserve.gov/datadownload/Choose.aspx?rel=H8",
      "coverageFrom": "1973-01-03",
      "frequency": "weekly",
      "availabilityClass": "vintage-proof-required",
      "role": "Deposit outflow, borrowing and bank-credit contraction signals for banking-credit.",
      "knownLimitations": ["Current histories are revised and benchmarked to Call Reports.", "Strict point-in-time use requires archived releases or immutable historical vintages."]
    },
    {
      "sourceId": "fred-nasdaqcom",
      "provider": "Nasdaq, Inc. via Federal Reserve Bank of St. Louis",
      "url": "https://fred.stlouisfed.org/series/NASDAQCOM",
      "coverageFrom": "1971-02-05",
      "frequency": "daily-close",
      "availabilityClass": "event-time-snapshot-required",
      "role": "Long-history equity drawdown and breadth proxy for broad-market repricing.",
      "knownLimitations": ["Copyright and redistribution terms require review.", "A Nasdaq-only universe is an imperfect proxy for the full U.S. market."]
    },
    {
      "sourceId": "fred-aaa10y",
      "provider": "Federal Reserve Bank of St. Louis / Moody's",
      "url": "https://fred.stlouisfed.org/series/AAA10Y",
      "coverageFrom": "1986-01-02",
      "frequency": "daily",
      "availabilityClass": "event-time-snapshot-required",
      "role": "High-grade credit leg used with BAA10Y to distinguish credit-quality dispersion from a common Treasury move.",
      "knownLimitations": ["Moody's licensing restrictions require an eligibility review.", "Treasury source-component changes require an explicit manifest."]
    },
    {
      "sourceId": "fred-baa10y",
      "provider": "Federal Reserve Bank of St. Louis / Moody's",
      "url": "https://fred.stlouisfed.org/series/BAA10Y",
      "coverageFrom": "1986-01-02",
      "frequency": "daily",
      "availabilityClass": "event-time-snapshot-required",
      "role": "Reused lower-grade credit leg; only the preregistered cross-quality dispersion is new.",
      "knownLimitations": ["This source was already present in E14.6 and cannot constitute the new hypothesis alone.", "Moody's licensing and source-component changes require review."]
    },
    {
      "sourceId": "bis-effective-exchange-rates",
      "provider": "Bank for International Settlements",
      "url": "https://data.bis.org/topics/EER",
      "coverageFrom": "1964-01-01",
      "frequency": "monthly-and-daily",
      "availabilityClass": "methodology-regime-specific",
      "role": "Long-history narrow and post-1994 broad dollar effective-rate shock measures for cross-border growth.",
      "knownLimitations": ["Broad and narrow indices have different coverage and must not be silently spliced.", "Time-varying trade weights and revisions require a methodology manifest."]
    },
    {
      "sourceId": "bis-locational-banking-statistics",
      "provider": "Bank for International Settlements",
      "url": "https://data.bis.org/topics/LBS",
      "coverageFrom": "1977-12-31",
      "frequency": "quarterly",
      "availabilityClass": "methodology-regime-specific",
      "role": "Break- and exchange-rate-adjusted cross-border bank flows for transmission intensity.",
      "knownLimitations": ["Reporting populations and methodology breaks remain explicit.", "Quarterly releases require publication-date joins and cannot be backfilled into prior months."]
    },
    {
      "sourceId": "federal-reserve-commercial-paper",
      "provider": "Board of Governors of the Federal Reserve System",
      "url": "https://www.federalreserve.gov/datadownload/Choose.aspx?rel=CP",
      "coverageFrom": "1997-01-02",
      "frequency": "daily",
      "availabilityClass": "event-time-snapshot-required",
      "role": "Unsecured financial commercial-paper tiering and volume for funding-liquidity.",
      "knownLimitations": ["Category definitions and issuer classifications have changed.", "Historical corrections require immutable snapshots and a correction audit."]
    },
    {
      "sourceId": "fred-dtb3",
      "provider": "Board of Governors of the Federal Reserve System via FRED",
      "url": "https://fred.stlouisfed.org/series/DTB3",
      "coverageFrom": "1954-01-04",
      "frequency": "daily",
      "availabilityClass": "event-time-snapshot-required",
      "role": "Matched Treasury-bill reference leg for commercial-paper spread construction.",
      "knownLimitations": ["Discount-basis alignment must be frozen before spread construction."]
    },
    {
      "sourceId": "new-york-fed-reference-rates",
      "provider": "Federal Reserve Bank of New York",
      "url": "https://www.newyorkfed.org/markets/reference-rates/sofr",
      "coverageFrom": "2018-04-03",
      "frequency": "daily",
      "availabilityClass": "methodology-regime-specific",
      "role": "SOFR, TGCR, BGCR, percentiles and volumes for secured funding dislocation after 2018.",
      "knownLimitations": ["SOFR-era features are not valid for 1998 and cannot be spliced to LIBOR-era proxies.", "Revisions and reduced-volume flags remain explicit."]
    }
  ],
  "mechanisms": [
    {
      "mechanism": "banking-credit",
      "diagnosedGap": "Failure counts and assistance assets detect only some events; they do not represent system balance-sheet deterioration, deposit pressure or credit contraction across all banking episodes.",
      "featureFamilies": [
        {
          "familyId": "bank-loss-absorption",
          "informationClass": "asset-quality-and-capital-deterioration",
          "sourceIds": ["fdic-aggregate-time-series"],
          "components": ["noncurrent-loan-share", "net-chargeoff-rate", "negative-equity-capital-ratio-change"],
          "stressDirection": "adverse-increase-after-component-normalization",
          "aggregation": "release-available-quarterly-carried-with-age",
          "allowedTransform": "causal-quarterly-change-percentile",
          "minimumHistoryMonths": 60,
          "missingnessPolicy": "explicit-missing-no-zero-imputation",
          "regimePolicy": "Quarterly field-definition breaks are separate regimes; no retrospective carry before publication month."
        },
        {
          "familyId": "bank-balance-sheet-flow",
          "informationClass": "deposit-outflow-borrowing-and-credit-contraction",
          "sourceIds": ["federal-reserve-h8"],
          "components": ["negative-deposit-growth", "borrowings-growth", "negative-bank-credit-growth"],
          "stressDirection": "adverse-increase-after-component-normalization",
          "aggregation": "monthly-maximum-of-weekly-adverse-change",
          "allowedTransform": "causal-rolling-percentile",
          "minimumHistoryMonths": 60,
          "missingnessPolicy": "explicit-missing-no-zero-imputation",
          "regimePolicy": "Foundation remains blocked until release-vintage semantics and benchmark revisions are manifested."
        }
      ],
      "episodeSignatures": [
        {"episodeId": "continental-illinois-1984", "onset": {"familyIds": ["bank-balance-sheet-flow"], "expectedDirection": "rise", "windowMonths": [-1, 1]}, "intensity": {"familyIds": ["bank-balance-sheet-flow", "bank-loss-absorption"], "expectedDirection": "remain-elevated", "windowMonths": [0, 3]}, "recovery": {"familyIds": ["bank-balance-sheet-flow"], "expectedDirection": "fall", "windowMonths": [1, 6]}, "falsificationCondition": "Neither deposit/borrowing pressure nor release-available loss absorption rises around the frozen episode."},
        {"episodeId": "euro-sovereign-stress-2011", "onset": {"familyIds": ["bank-balance-sheet-flow"], "expectedDirection": "rise", "windowMonths": [-1, 2]}, "intensity": {"familyIds": ["bank-balance-sheet-flow", "bank-loss-absorption"], "expectedDirection": "remain-elevated", "windowMonths": [0, 4]}, "recovery": {"familyIds": ["bank-balance-sheet-flow"], "expectedDirection": "fall", "windowMonths": [1, 6]}, "falsificationCondition": "U.S. bank flows and release-available asset-quality measures remain within their prior causal regimes."},
        {"episodeId": "regional-bank-stress-2023", "onset": {"familyIds": ["bank-balance-sheet-flow"], "expectedDirection": "rise", "windowMonths": [-1, 1]}, "intensity": {"familyIds": ["bank-balance-sheet-flow", "bank-loss-absorption"], "expectedDirection": "remain-elevated", "windowMonths": [0, 3]}, "recovery": {"familyIds": ["bank-balance-sheet-flow"], "expectedDirection": "fall", "windowMonths": [1, 6]}, "falsificationCondition": "Deposit outflow and borrowing pressure fail to rise despite the documented banking episode."}
      ],
      "ablationIds": ["bank-loss-only", "bank-flow-only", "bank-leave-one-family-out", "bank-new-only-vs-new-plus-legacy"]
    },
    {
      "mechanism": "broad-market-repricing",